{
  "$schema": "https://changesaga.dev/schema/v5/quality-policy.schema.json",
  "version": 5,
  "id": "refund-cutoff-kinds",
  "criterion": "urn:change-saga:checkout-refund:story:refund-window:criterion:at-or-after-deadline",
  "story_revision": "urn:change-saga:checkout-refund:story:refund-window:revision:r2",
  "required_kinds": ["positive", "negative", "edge"],
  "allowed_automation": ["automated", "manual"],
  "supersedes": [],
  "rationale": "The boundary has distinct success, rejection, and exact-cutoff risks.",
  "created_at": "2026-09-17T20:10:00Z"
}
